{
  "$schema": "http://json-schema.org/draft-07/schema#",
  "$id": "https://github.com/Ismail-elkorchi/text-computing/schemas/dependency-parser-comparison-v1.schema.json",
  "title": "Dependency parser comparator capture v1",
  "type": "object",
  "additionalProperties": false,
  "required": [
    "schemaVersion",
    "scope",
    "capturedDate",
    "comparator",
    "executionStatus",
    "slices",
    "notes"
  ],
  "properties": {
    "schemaVersion": { "const": 1 },
    "scope": { "const": "dependency-parser" },
    "capturedDate": { "type": "string", "pattern": "^[0-9]{4}-[0-9]{2}-[0-9]{2}$" },
    "comparator": {
      "type": "object",
      "additionalProperties": false,
      "required": ["name", "version", "runtime", "artifactSurface"],
      "properties": {
        "name": { "type": "string", "minLength": 1 },
        "version": { "type": "string", "minLength": 1 },
        "runtime": { "enum": ["python", "jvm", "javascript", "other"] },
        "artifactSurface": { "type": "string", "minLength": 1 }
      }
    },
    "executionStatus": {
      "enum": [
        "capability-recorded",
        "executed"
      ]
    },
    "slices": {
      "type": "array",
      "minItems": 1,
      "items": { "$ref": "#/definitions/sliceComparison" }
    },
    "notes": {
      "type": "array",
      "minItems": 1,
      "items": { "type": "string", "minLength": 1 }
    }
  },
  "definitions": {
    "sliceComparison": {
      "type": "object",
      "additionalProperties": false,
      "required": ["fixtureId", "status", "expectedArcPath"],
      "properties": {
        "fixtureId": { "type": "string", "pattern": "^[a-z0-9-]+$" },
        "status": {
          "enum": [
            "output-not-captured",
            "captured"
          ]
        },
        "expectedArcPath": {
          "type": "string",
          "pattern": "^fixtures/dependency-parser/expected/[a-z0-9-]+\\.json$"
        },
        "reason": { "type": "string", "minLength": 1 },
        "outputArcs": {
          "type": "array",
          "items": {
            "type": "object",
            "additionalProperties": false,
            "required": ["dependent", "head", "relation"],
            "properties": {
              "dependent": { "type": "string", "pattern": "^[1-9][0-9]*$" },
              "head": { "type": "string", "pattern": "^[0-9]+$" },
              "relation": { "type": "string", "pattern": "^[a-z]+(:[a-z]+)?$" }
            }
          }
        }
      }
    }
  }
}
