{
  "schemaVersion": 1,
  "scope": "dependency-parser",
  "capturedDate": "2026-05-15",
  "comparator": {
    "name": "Stanza DepparseProcessor",
    "version": "1.11.x documentation snapshot",
    "runtime": "python",
    "artifactSurface": "UD-style head and dependency relation fields"
  },
  "executionStatus": "capability-recorded",
  "slices": [
    {
      "fixtureId": "en-basic",
      "status": "output-not-captured",
      "expectedArcPath": "fixtures/dependency-parser/expected/en-basic.json",
      "reason": "The Stanza runtime depends on heavyweight model assets that are not vendored in this repository."
    },
    {
      "fixtureId": "es-mwt",
      "status": "output-not-captured",
      "expectedArcPath": "fixtures/dependency-parser/expected/es-mwt.json",
      "reason": "The Stanza runtime depends on heavyweight model assets that are not vendored in this repository."
    }
  ],
  "notes": [
    "The public documentation records a UD-style dependency parser surface. This file does not claim executed output."
  ]
}
